{"dataSources":[{"argumentBindings":[],"arguments":{},"id":"documents","pageSize":100,"query":"view.list"},{"argumentBindings":[],"arguments":{},"id":"newSite","pageSize":1,"query":"site/view.new"},{"argumentBindings":[{"argument":"id","rowField":"id","sourceId":"documents"},{"argument":"revision","rowField":"revision","sourceId":"documents"}],"arguments":{},"id":"siteEditor","pageSize":1,"query":"site/view.selected"},{"argumentBindings":[],"arguments":{},"id":"siteCredentials","pageSize":100,"query":"site/view.credentials"},{"argumentBindings":[],"arguments":{},"id":"sitePrivateNetworkGrants","pageSize":100,"query":"site/view.private-network-grants"}],"nodes":[{"actions":[],"body":"Workspace 由当前请求隐式绑定。凭据与私网授权只绑定已有资源的精确版本；Origin 变化会清除旧绑定并立即使旧 Browser 会话失效。","id":"site-authority-boundary","title":"权限来源","type":"card"},{"actions":[],"columns":[{"field":"name","label":"名称","width":200},{"field":"origin","label":"网址","width":300},{"field":"enabled","label":"启用","width":80}],"id":"sites","keyField":"id","selection":"SINGLE","sourceId":"documents","title":"网站","type":"table"},{"fields":[{"binding":{"field":"id","sourceId":"newSite"},"initialValue":null,"label":"Site 标识","name":"id","optionSource":null,"options":[],"type":"TEXT","validation":{"attachment":null,"maxLength":100,"maximum":null,"minLength":1,"minimum":null,"required":true},"visibleWhen":null},{"binding":{"field":"name","sourceId":"newSite"},"initialValue":null,"label":"名称","name":"name","optionSource":null,"options":[],"type":"TEXT","validation":{"attachment":null,"maxLength":200,"maximum":null,"minLength":1,"minimum":null,"required":true},"visibleWhen":null},{"binding":{"field":"origin","sourceId":"newSite"},"initialValue":"https://example.com","label":"主 HTTPS Origin","name":"origin","optionSource":null,"options":[],"type":"TEXT","validation":{"attachment":null,"maxLength":2048,"maximum":null,"minLength":1,"minimum":null,"required":true},"visibleWhen":null},{"binding":{"field":"allowedOrigins","sourceId":"newSite"},"initialRows":[{"itemKey":"origin-1","origin":"https://example.com"}],"itemFields":[{"initialTextList":[],"initialValue":null,"label":"HTTPS Origin","name":"origin","optionSource":null,"options":[],"type":"TEXT","validation":{"maxItems":null,"maxLength":2048,"maximum":null,"minItems":null,"minLength":1,"minimum":null,"required":true}}],"itemKey":"itemKey","label":"允许的精确 Origin","maxRows":100,"minRows":1,"name":"allowedOrigins","type":"STRUCTURED_LIST","visibleWhen":null},{"binding":{"field":"enabled","sourceId":"newSite"},"initialValue":"true","label":"启用","name":"enabled","optionSource":null,"options":[],"type":"BOOLEAN","validation":{"attachment":null,"maxLength":null,"maximum":null,"minLength":null,"minimum":null,"required":false},"visibleWhen":null}],"id":"site-create","submit":{"arguments":{},"command":"site/create","commandBindings":[],"dangerous":false,"expectedRevision":{"field":null,"sourceId":null,"type":"none"},"label":"创建网站","rowArguments":{}},"title":"新建网站","type":"form"},{"fields":[{"binding":{"field":"name","sourceId":"siteEditor"},"initialValue":null,"label":"名称","name":"name","optionSource":null,"options":[],"type":"TEXT","validation":{"attachment":null,"maxLength":200,"maximum":null,"minLength":1,"minimum":null,"required":true},"visibleWhen":null},{"binding":{"field":"origin","sourceId":"siteEditor"},"initialValue":"https://example.com","label":"主 HTTPS Origin","name":"origin","optionSource":null,"options":[],"type":"TEXT","validation":{"attachment":null,"maxLength":2048,"maximum":null,"minLength":1,"minimum":null,"required":true},"visibleWhen":null},{"binding":{"field":"allowedOrigins","sourceId":"siteEditor"},"initialRows":[{"itemKey":"origin-1","origin":"https://example.com"}],"itemFields":[{"initialTextList":[],"initialValue":null,"label":"HTTPS Origin","name":"origin","optionSource":null,"options":[],"type":"TEXT","validation":{"maxItems":null,"maxLength":2048,"maximum":null,"minItems":null,"minLength":1,"minimum":null,"required":true}}],"itemKey":"itemKey","label":"允许的精确 Origin","maxRows":100,"minRows":1,"name":"allowedOrigins","type":"STRUCTURED_LIST","visibleWhen":null},{"binding":{"field":"enabled","sourceId":"siteEditor"},"initialValue":"true","label":"启用","name":"enabled","optionSource":null,"options":[],"type":"BOOLEAN","validation":{"attachment":null,"maxLength":null,"maximum":null,"minLength":null,"minimum":null,"required":false},"visibleWhen":null}],"id":"site-edit","submit":{"arguments":{},"command":"site/update","commandBindings":[{"argumentName":"id","binding":{"field":"id","sourceId":"siteEditor"}}],"dangerous":false,"expectedRevision":{"field":null,"sourceId":"siteEditor","type":"source"},"label":"保存网站","rowArguments":{}},"title":"网站信息","type":"form"},{"fields":[{"binding":{"field":"credentialKind","sourceId":"siteEditor"},"initialValue":"BEARER","label":"凭据用途","name":"kind","optionSource":null,"options":[{"label":"Bearer Token","value":"BEARER"},{"label":"API Key Header","value":"API_KEY_HEADER"}],"type":"CHOICE","validation":{"attachment":null,"maxLength":null,"maximum":null,"minLength":null,"minimum":null,"required":true},"visibleWhen":null},{"binding":{"field":"credentialId","sourceId":"siteEditor"},"initialValue":null,"label":"Vault 凭据","name":"credentialId","optionSource":{"filter":null,"labelField":"label","sourceId":"siteCredentials","valueField":"id"},"options":[],"type":"CHOICE","validation":{"attachment":null,"maxLength":null,"maximum":null,"minLength":null,"minimum":null,"required":true},"visibleWhen":null},{"binding":{"field":"apiKeyHeader","sourceId":"siteEditor"},"initialValue":null,"label":"API Key Header","name":"apiKeyHeader","optionSource":null,"options":[],"type":"TEXT","validation":{"attachment":null,"maxLength":80,"maximum":null,"minLength":1,"minimum":null,"required":true},"visibleWhen":{"binding":{"field":"credentialKind","sourceId":"siteEditor"},"expectedValue":"API_KEY_HEADER","operator":"EQUALS"}}],"id":"site-credential-bind","submit":{"arguments":{},"command":"site/credential/bind","commandBindings":[{"argumentName":"siteId","binding":{"field":"id","sourceId":"siteEditor"}},{"argumentName":"expectedAuthorityRevision","binding":{"field":"authorityRevision","sourceId":"siteEditor"}}],"dangerous":false,"expectedRevision":{"field":null,"sourceId":"siteEditor","type":"source"},"label":"绑定凭据","rowArguments":{}},"title":"绑定 HTTP 凭据","type":"form"},{"fields":[{"binding":{"field":"privateNetworkGrantId","sourceId":"siteEditor"},"initialValue":null,"label":"Site 私网授权","name":"grantId","optionSource":{"filter":null,"labelField":"label","sourceId":"sitePrivateNetworkGrants","valueField":"id"},"options":[],"type":"CHOICE","validation":{"attachment":null,"maxLength":null,"maximum":null,"minLength":null,"minimum":null,"required":true},"visibleWhen":null}],"id":"site-private-network-bind","submit":{"arguments":{},"command":"site/private-network/bind","commandBindings":[{"argumentName":"siteId","binding":{"field":"id","sourceId":"siteEditor"}},{"argumentName":"expectedAuthorityRevision","binding":{"field":"authorityRevision","sourceId":"siteEditor"}}],"dangerous":true,"expectedRevision":{"field":null,"sourceId":"siteEditor","type":"source"},"label":"绑定私网授权","rowArguments":{}},"title":"绑定私网授权","type":"form"},{"actions":[{"arguments":{},"command":"site/credential/clear","commandBindings":[{"argumentName":"siteId","binding":{"field":"id","sourceId":"siteEditor"}},{"argumentName":"expectedAuthorityRevision","binding":{"field":"authorityRevision","sourceId":"siteEditor"}}],"dangerous":true,"expectedRevision":{"field":null,"sourceId":"siteEditor","type":"source"},"label":"清除凭据","rowArguments":{}},{"arguments":{},"command":"site/private-network/clear","commandBindings":[{"argumentName":"siteId","binding":{"field":"id","sourceId":"siteEditor"}},{"argumentName":"expectedAuthorityRevision","binding":{"field":"authorityRevision","sourceId":"siteEditor"}}],"dangerous":true,"expectedRevision":{"field":null,"sourceId":"siteEditor","type":"source"},"label":"清除私网授权","rowArguments":{}},{"arguments":{},"command":"delete","commandBindings":[{"argumentName":"id","binding":{"field":"id","sourceId":"siteEditor"}}],"dangerous":true,"expectedRevision":{"field":null,"sourceId":"siteEditor","type":"source"},"label":"删除网站","rowArguments":{}}],"body":"仅操作当前选中的网站；清除绑定或删除前需要确认。","id":"site-actions","title":"危险操作","type":"card"}],"schemaVersion":2,"title":"网站管理","viewId":"com.javaclaw.site.management"}
